{
  "$schema": "https://json-schema.org/draft/2020-12/schema",
  "$id": "ground_truth.schema.json",
  "title": "Synthetic audio fixture ground truth",
  "type": "object",
  "additionalProperties": false,
  "required": [
    "schema_version",
    "audio",
    "bpm",
    "time_signature",
    "duration",
    "first_downbeat",
    "onsets",
    "strong_onsets",
    "beats",
    "downbeats",
    "low_band_onsets",
    "high_band_onsets",
    "silent_ranges",
    "fill_ranges",
    "sections"
  ],
  "properties": {
    "schema_version": {
      "const": 1
    },
    "audio": {
      "type": "string",
      "pattern": "^[^/\\\\]+\\.wav$"
    },
    "bpm": {
      "type": "number",
      "exclusiveMinimum": 0
    },
    "time_signature": {
      "enum": [
        "4/4",
        "3/4",
        "6/8"
      ]
    },
    "duration": {
      "type": "number",
      "exclusiveMinimum": 0
    },
    "first_downbeat": {
      "type": "number",
      "minimum": 0
    },
    "onsets": {
      "$ref": "#/$defs/times"
    },
    "strong_onsets": {
      "$ref": "#/$defs/times"
    },
    "beats": {
      "$ref": "#/$defs/times"
    },
    "downbeats": {
      "$ref": "#/$defs/times"
    },
    "low_band_onsets": {
      "$ref": "#/$defs/times"
    },
    "high_band_onsets": {
      "$ref": "#/$defs/times"
    },
    "silent_ranges": {
      "$ref": "#/$defs/ranges"
    },
    "fill_ranges": {
      "$ref": "#/$defs/ranges"
    },
    "sections": {
      "type": "array",
      "items": {
        "type": "object",
        "additionalProperties": false,
        "required": [
          "start",
          "end",
          "role"
        ],
        "properties": {
          "start": {
            "type": "number",
            "minimum": 0
          },
          "end": {
            "type": "number",
            "exclusiveMinimum": 0
          },
          "role": {
            "type": "string",
            "minLength": 1
          }
        }
      }
    }
  },
  "$defs": {
    "times": {
      "type": "array",
      "items": {
        "type": "number",
        "minimum": 0
      }
    },
    "ranges": {
      "type": "array",
      "items": {
        "type": "array",
        "prefixItems": [
          {
            "type": "number",
            "minimum": 0
          },
          {
            "type": "number",
            "exclusiveMinimum": 0
          }
        ],
        "items": false,
        "minItems": 2,
        "maxItems": 2
      }
    }
  }
}
