{
  "schema_version": 1,
  "audio": "mixed_120.wav",
  "bpm": 120.0,
  "time_signature": "4/4",
  "duration": 9.0,
  "first_downbeat": 0.5,
  "onsets": [
    0.5,
    0.625,
    0.75,
    0.875,
    1.0,
    1.125,
    1.25,
    1.375,
    1.5,
    1.625,
    1.75,
    1.875,
    2.0,
    2.125,
    2.25,
    2.375,
    2.5,
    2.666666667,
    2.833333333,
    3.0,
    3.166666667,
    3.333333333,
    3.5,
    3.666666667,
    3.833333333,
    4.0,
    4.166666667,
    4.333333333,
    4.5,
    4.625,
    4.75,
    4.875,
    5.0,
    5.125,
    5.25,
    5.375,
    5.5,
    5.625,
    5.75,
    5.875,
    6.0,
    6.125,
    6.25,
    6.375,
    6.5,
    6.666666667,
    6.833333333,
    7.0,
    7.166666667,
    7.333333333,
    7.5,
    7.666666667,
    7.833333333,
    8.0,
    8.166666667,
    8.333333333
  ],
  "strong_onsets": [
    0.5,
    2.5,
    4.5,
    6.5
  ],
  "beats": [
    0.5,
    1.0,
    1.5,
    2.0,
    2.5,
    3.0,
    3.5,
    4.0,
    4.5,
    5.0,
    5.5,
    6.0,
    6.5,
    7.0,
    7.5,
    8.0
  ],
  "downbeats": [
    0.5,
    2.5,
    4.5,
    6.5
  ],
  "low_band_onsets": [],
  "high_band_onsets": [],
  "silent_ranges": [
    [
      0.0,
      0.5
    ]
  ],
  "fill_ranges": [],
  "sections": []
}
