{
  "schema_version": 1,
  "audio": "band_attacks_120.wav",
  "bpm": 120.0,
  "time_signature": "4/4",
  "duration": 17.0,
  "first_downbeat": 0.5,
  "onsets": [
    0.5,
    0.75,
    1.0,
    1.25,
    1.5,
    1.75,
    2.0,
    2.25,
    2.5,
    2.75,
    3.0,
    3.25,
    3.5,
    3.75,
    4.0,
    4.25,
    4.5,
    4.75,
    5.0,
    5.25,
    5.5,
    5.75,
    6.0,
    6.25,
    6.5,
    6.75,
    7.0,
    7.25,
    7.5,
    7.75,
    8.0,
    8.25,
    8.5,
    8.75,
    9.0,
    9.25,
    9.5,
    9.75,
    10.0,
    10.25,
    10.5,
    10.75,
    11.0,
    11.25,
    11.5,
    11.75,
    12.0,
    12.25,
    12.5,
    12.75,
    13.0,
    13.25,
    13.5,
    13.75,
    14.0,
    14.25,
    14.5,
    14.75,
    15.0,
    15.25,
    15.5,
    15.75,
    16.0,
    16.25
  ],
  "strong_onsets": [
    0.5,
    2.5,
    4.5,
    6.5,
    8.5,
    10.5,
    12.5,
    14.5
  ],
  "beats": [
    0.5,
    1.0,
    1.5,
    2.0,
    2.5,
    3.0,
    3.5,
    4.0,
    4.5,
    5.0,
    5.5,
    6.0,
    6.5,
    7.0,
    7.5,
    8.0,
    8.5,
    9.0,
    9.5,
    10.0,
    10.5,
    11.0,
    11.5,
    12.0,
    12.5,
    13.0,
    13.5,
    14.0,
    14.5,
    15.0,
    15.5,
    16.0
  ],
  "downbeats": [
    0.5,
    2.5,
    4.5,
    6.5,
    8.5,
    10.5,
    12.5,
    14.5
  ],
  "low_band_onsets": [
    0.5,
    1.0,
    1.5,
    2.0,
    2.5,
    3.0,
    3.5,
    4.0,
    4.5,
    5.0,
    5.5,
    6.0,
    6.5,
    7.0,
    7.5,
    8.0,
    8.5,
    9.0,
    9.5,
    10.0,
    10.5,
    11.0,
    11.5,
    12.0,
    12.5,
    13.0,
    13.5,
    14.0,
    14.5,
    15.0,
    15.5,
    16.0
  ],
  "high_band_onsets": [
    0.75,
    1.25,
    1.75,
    2.25,
    2.75,
    3.25,
    3.75,
    4.25,
    4.75,
    5.25,
    5.75,
    6.25,
    6.75,
    7.25,
    7.75,
    8.25,
    8.75,
    9.25,
    9.75,
    10.25,
    10.75,
    11.25,
    11.75,
    12.25,
    12.75,
    13.25,
    13.75,
    14.25,
    14.75,
    15.25,
    15.75,
    16.25
  ],
  "silent_ranges": [
    [
      0.0,
      0.5
    ]
  ],
  "fill_ranges": [],
  "sections": []
}
