{
  "schema_version": 1,
  "audio": "structure_build_up_120.wav",
  "bpm": 120.0,
  "time_signature": "4/4",
  "duration": 25.0,
  "first_downbeat": 0.5,
  "onsets": [
    0.5,
    1.0,
    1.5,
    2.0,
    2.5,
    3.0,
    3.5,
    4.0,
    4.5,
    5.0,
    5.5,
    6.0,
    6.5,
    7.0,
    7.5,
    8.0,
    8.5,
    9.0,
    9.5,
    10.0,
    10.5,
    10.75,
    11.0,
    11.25,
    11.5,
    11.75,
    12.0,
    12.25,
    12.5,
    12.666666667,
    12.833333333,
    13.0,
    13.166666667,
    13.333333333,
    13.5,
    13.666666667,
    13.833333333,
    14.0,
    14.166666667,
    14.333333333,
    14.5,
    14.625,
    14.75,
    14.875,
    15.0,
    15.125,
    15.25,
    15.375,
    15.5,
    15.625,
    15.75,
    15.875,
    16.0,
    16.125,
    16.25,
    16.375,
    16.5,
    16.625,
    16.75,
    16.875,
    17.0,
    17.125,
    17.25,
    17.375,
    17.5,
    17.625,
    17.75,
    17.875,
    18.0,
    18.125,
    18.25,
    18.375,
    18.5,
    18.625,
    18.75,
    18.875,
    19.0,
    19.125,
    19.25,
    19.375,
    19.5,
    19.625,
    19.75,
    19.875,
    20.0,
    20.125,
    20.25,
    20.375,
    20.5,
    21.0,
    21.5,
    22.0,
    22.5,
    23.0,
    23.5,
    24.0
  ],
  "strong_onsets": [
    0.5,
    2.5,
    4.5,
    6.5,
    8.5,
    10.5,
    12.5,
    14.5,
    16.5,
    18.5,
    20.5,
    22.5
  ],
  "beats": [
    0.5,
    1.0,
    1.5,
    2.0,
    2.5,
    3.0,
    3.5,
    4.0,
    4.5,
    5.0,
    5.5,
    6.0,
    6.5,
    7.0,
    7.5,
    8.0,
    8.5,
    9.0,
    9.5,
    10.0,
    10.5,
    11.0,
    11.5,
    12.0,
    12.5,
    13.0,
    13.5,
    14.0,
    14.5,
    15.0,
    15.5,
    16.0,
    16.5,
    17.0,
    17.5,
    18.0,
    18.5,
    19.0,
    19.5,
    20.0,
    20.5,
    21.0,
    21.5,
    22.0,
    22.5,
    23.0,
    23.5,
    24.0
  ],
  "downbeats": [
    0.5,
    2.5,
    4.5,
    6.5,
    8.5,
    10.5,
    12.5,
    14.5,
    16.5,
    18.5,
    20.5,
    22.5
  ],
  "low_band_onsets": [],
  "high_band_onsets": [],
  "silent_ranges": [
    [
      0.0,
      0.5
    ]
  ],
  "fill_ranges": [],
  "sections": [
    {
      "start": 0.5,
      "end": 10.5,
      "role": "stable"
    },
    {
      "start": 10.5,
      "end": 16.5,
      "role": "build_up"
    },
    {
      "start": 16.5,
      "end": 20.5,
      "role": "peak"
    },
    {
      "start": 20.5,
      "end": 24.5,
      "role": "drop"
    }
  ]
}
